{
  "tool": "dir",
  "tool_summary": "Lists files and directories in a specified directory.",
  "platform": "windows",
  "platform_notes": "The 'dir' command is an internal command of the Windows Command Prompt (cmd.exe). It provides similar functionality to the POSIX 'ls' utility but uses different flag syntax (/ instead of -) and behaves according to Windows filesystem attribute rules.",
  "llm_confidence": "high",
  "unknown_flags": [],
  "is_multiplexer": false,
  "option_abbreviations": {},
  "rules": [
    {
      "id": "dir-recursive",
      "description": "The /S flag performs a recursive search through the specified directory and all its subdirectories.",
      "patterns": [
        {
          "pattern": "dir /s ...",
          "pattern_type": "flag",
          "example": "dir /s C:\\Users",
          "match": {
            "flags_any": [
              "/s"
            ]
          }
        }
      ],
      "risk_tags": [
        "reads-files",
        "recursive"
      ],
      "mitre_attack": [],
      "reversible": "yes",
      "severity": "INFO"
    },
    {
      "id": "dir-attributes",
      "description": "The /A flag displays files with specified attributes, including hidden and system files that are normally omitted from the listing.",
      "patterns": [
        {
          "pattern": "dir /a ...",
          "pattern_type": "flag",
          "example": "dir /a",
          "match": {
            "flags_any": [
              "/a"
            ]
          }
        }
      ],
      "risk_tags": [
        "reads-files"
      ],
      "mitre_attack": [],
      "reversible": "yes",
      "severity": "INFO"
    }
  ],
  "default_rule": {
    "risk_tags": [
      "reads-files"
    ],
    "mitre_attack": [],
    "reversible": "yes",
    "severity": "INFO"
  }
}
