{
  "tool": "source",
  "tool_summary": "A shell builtin (also available as `.` in POSIX sh) that executes a script's contents in the current shell context rather than a subshell, meaning it can modify the calling shell's environment variables, working directory, functions, and aliases directly.",
  "platform": "posix",
  "platform_notes": "source is a bash/zsh builtin; POSIX sh uses `.` (dot) for the same operation. Behavior of executing in the current shell context (rather than forking) is the defining characteristic and is consistent across both spellings.",
  "llm_confidence": "high",
  "unknown_flags": [],
  "is_multiplexer": true,
  "option_abbreviations": {},
  "rules": [
    {
      "id": "source-executes-in-current-context",
      "description": "Executes a script's contents directly in the current shell, rather than in a subshell as a normal script invocation would. This means the sourced script can silently alter the invoking shell's environment variables, current directory, PATH, aliases, or functions -- changes that persist after the source command completes and are not visible as a separate process. The script's content is not visible in the command string and cannot currently be inspected by commandant.",
      "patterns": [
        {
          "pattern": "source $SCRIPT",
          "pattern_type": "argument",
          "example": "source ./setup-env.sh",
          "match": {
            "raw_pattern": "^source(\\s|$)"
          }
        }
      ],
      "risk_tags": [
        "modifies-environment",
        "executes-code"
      ],
      "likely_consequences": [
        "unsafe-code-execution"
      ],
      "reversible": "depends",
      "reversible_note": "Reversibility depends entirely on the sourced script's contents, which commandant does not inspect. Unlike a normal script invocation, environment changes made by a sourced script persist in the calling shell after the command completes, which can affect the behavior of every subsequent command in the session. See R-INS-03.",
      "severity": "ERROR",
      "mitre_attack": [
        "T1059.004"
      ]
    }
  ],
  "default_rule": {
    "risk_tags": [
      "modifies-environment",
      "executes-code"
    ],
    "reversible": "depends",
    "severity": "ERROR",
    "mitre_attack": [
      "T1059.004"
    ]
  }
}
